<?xml version="1.0" encoding="UTF-8"?>
<macroscopicdemand xmlns:xsi="http://www.w3.org/2001/XMLSchema-instance" 
                                     xsi:noNamespaceSchemaLocation="../../../../../main/resources/macroscopicdemandinput.xsd">
      
   <demandconfiguration>
	    <userclasses>
	    	<userclass id="1" moderef="1">
	    		<name>1</name>
	    	</userclass>
	    </userclasses>
	    <timeperiods>
	    	<timeperiod id="0">
	    		<name>1</name>
	    		<starttime>00:00:01</starttime>
	    		<duration>86400</duration>
	    	</timeperiod>
	    </timeperiods> 
   </demandconfiguration>
       
	<oddemands>
		<odrawmatrix timeperiodref="0" userclassref="1">
			<values os=" " ds="+">100+200+300+400 200+400+600+800 300+600+900+1200 400+800+1200+1600</values>
		</odrawmatrix>
	</oddemands>
</macroscopicdemand>


