<?xml version="1.0" encoding="UTF-8"?>
<macroscopicdemand xmlns:xsi="http://www.w3.org/2001/XMLSchema-instance" 
                                     xsi:noNamespaceSchemaLocation="../../../../../main/resources/macroscopicdemandinput.xsd">
      
   <configuration>
	    <userclasses>
	    	<userclass id="1" moderef="1">
	    		<name>1</name>
	    	</userclass>
	    </userclasses>
	    <timeperiods>
	    	<timeperiod id="0">
	    		<name>1</name>
	    		<starttime>00:00:01</starttime>
	    		<duration>86400</duration>
	    	</timeperiod>
	    </timeperiods> 
   </configuration>
       
	<oddemands>
		<odcellbycellmatrix timeperiodref="0" userclassref="1">
			<o ref="3">																
				<d ref="4">1000</d> 
			</o>
			<o ref="5">																
				<d ref="1">1000</d> 
			</o>
			<o ref="2">																
				<d ref="6">1000</d> 
			</o>
		</odcellbycellmatrix>
	</oddemands>
</macroscopicdemand>


