<?xml version="1.0" encoding="UTF-8"?>
<macroscopicdemand xmlns:xsi="http://www.w3.org/2001/XMLSchema-instance" 
                                     xsi:noNamespaceSchemaLocation="../../../../../main/resources/macroscopicdemandinput.xsd">
      
   <demandconfiguration>
	    <userclasses>
	    	<userclass id="1" moderef="1">
	    		<name>1</name>
	    	</userclass>
	    </userclasses>
	    <timeperiods>
	    	<timeperiod id="0">
	    		<name>Time Period 1</name>
	    		<starttime>00:00:01</starttime>
	    		<duration>86400</duration>
	    	</timeperiod>
	    </timeperiods> 
   </demandconfiguration>
       
	<oddemands>
		<odrowmatrix timeperiodref="0" userclassref="1">
			<odrow ref="1">100,200,300,400</odrow>
			<odrow ref="2">200,400,600,800</odrow>
			<odrow ref="3">300,600,900,1200</odrow>
			<odrow ref="4">400,800,1200,1600</odrow>
		</odrowmatrix>
	</oddemands>
</macroscopicdemand>


