<?xml version="1.0" encoding="ISO-8859-1"?>
<macroscopicdemand
	 xmlns:xsi="http://www.w3.org/2001/XMLSchema-instance"								
	 xsi:noNamespaceSchemaLocation="../schema/macroscopicdemandinput.xsd">					
	<configuration>																					
		<timeperiods>																
			<timeperiod id="1">
				<duration>3600</duration>											<!-- duration in seconds -->
			</timeperiod>
		</timeperiods>
	</configuration>
	<oddemands>																		
		<odmatrix timeperiodref="1">
			<o ref="1">																
				<d ref="1">0.0</d>													
				<d ref="2">150.0</d> 
			</o>
			<o ref="2">
				<d ref="1">300</d>
			</o>
		</odmatrix>
	</oddemands>
</macroscopicdemand>