<?xml version="1.0" encoding="UTF-8"?>
<macroscopicdemand xmlns:xsi="http://www.w3.org/2001/XMLSchema-instance" 
                        xsi:noNamespaceSchemaLocation="../../../../../main/resources/schema/macroscopicdemandinput.xsd">
      
   <configuration>
	    <userclasses>
	    	<userclass id="1" moderef="1">
	    		<name>1</name>
	    	</userclass>
	    </userclasses>
	    <timeperiods>
	    	<timeperiod id="1">
	    		<name>1</name>
	    		<starttime>00:00:01</starttime>
	    		<duration>43200</duration>
	    	</timeperiod>
	    	<timeperiod id="2">
	    		<name>2</name>
	    		<starttime>12:00:01</starttime>
	    		<duration>43200</duration>
	    	</timeperiod>
	    </timeperiods> 
   </configuration>
       
	<oddemands>
		<odrowmatrix timeperiodref="1" userclassref="1">
			<odrow ref="1">100,200,300,400</odrow>
			<odrow ref="2">200,400,600,800</odrow>
			<odrow ref="3">300,600,900,1200</odrow>
			<odrow ref="4">400,800,1200,1600</odrow>
		</odrowmatrix>
		<odrowmatrix timeperiodref="2" userclassref="1">
			<odrow ref="1">100,200,300,400</odrow>
			<odrow ref="2">200,400,600,800</odrow>
			<odrow ref="3">300,600,900,1200</odrow>
			<odrow ref="4">400,800,1200,1600</odrow>
		</odrowmatrix>
	</oddemands>
</macroscopicdemand>


